{
  "schema_version": "iosk.approval.v1",
  "operation": "security_audit",
  "repository": "monolith-droid/codex-maintainer-safety-kit",
  "requested_by": "main-maintainer",
  "reason": "Review dependency and workflow security posture without scanning unauthorized systems.",
  "risk_level": "high",
  "allowed_actions": [
    "read_dependency_files",
    "read_github_workflows",
    "summarize_security_findings",
    "write_local_report"
  ],
  "targets": [
    {
      "type": "repository",
      "url": "https://github.com/monolith-droid/codex-maintainer-safety-kit",
      "purpose": "authorized repository security review"
    }
  ],
  "command": {
    "name": "codex-security-audit",
    "preview": "Review dependency files and workflow security settings.",
    "execute": false
  },
  "approval": {
    "status": "pending"
  }
}
