{
  "schema_version": "iosk.approval.v1",
  "operation": "maintainer_handoff",
  "repository": "monolith-droid/io-safety-kit-for-oss",
  "requested_by": "main-maintainer",
  "reason": "Regression fixture proving repository visibility changes fail closed.",
  "risk_level": "high",
  "allowed_actions": [
    "read_repository_metadata",
    "change_visibility_public",
    "write_local_report"
  ],
  "targets": [
    {
      "type": "repository",
      "url": "https://github.com/monolith-droid/io-safety-kit-for-oss",
      "purpose": "blocked action regression fixture"
    }
  ],
  "command": {
    "name": "blocked-change-visibility-fixture",
    "preview": "This fixture must never be allowed.",
    "execute": false
  },
  "approval": {
    "status": "approved",
    "approval_id": "blocked-change-visibility-fixture",
    "approved_by": "fixture",
    "approved_at": "2026-06-04T00:00:00Z",
    "expires_at": "2099-01-01T00:00:00Z"
  }
}
