{
  "schema_version": "iosk.approval.v1",
  "operation": "release_checklist",
  "repository": "monolith-droid/codex-maintainer-safety-kit",
  "requested_by": "main-maintainer",
  "reason": "Prepare release notes and a release readiness checklist for v0.1.0.",
  "risk_level": "medium",
  "allowed_actions": [
    "read_commits",
    "read_closed_issues",
    "draft_release_notes",
    "write_local_report"
  ],
  "targets": [
    {
      "type": "release",
      "ref": "v0.1.0",
      "purpose": "draft release checklist only"
    }
  ],
  "command": {
    "name": "codex-release-checklist",
    "preview": "Draft release notes and readiness checks.",
    "execute": false
  },
  "approval": {
    "status": "approved",
    "approval_id": "demo-release-checklist-001",
    "approved_by": "main-maintainer",
    "approved_at": "2026-06-04T00:00:00Z",
    "expires_at": "2099-01-01T00:00:00Z"
  }
}
