{
  "schema_version": "iosk.approval.v1",
  "operation": "pr_review",
  "repository": "monolith-droid/io-safety-kit-for-oss",
  "requested_by": "main-maintainer",
  "reason": "Review a pull request for regressions, missing tests, and maintainer follow-up items.",
  "risk_level": "low",
  "allowed_actions": [
    "read_pull_request_diff",
    "summarize_risks",
    "suggest_review_comments",
    "write_local_report"
  ],
  "targets": [
    {
      "type": "pull_request",
      "url": "https://github.com/monolith-droid/io-safety-kit-for-oss/pull/1",
      "purpose": "review candidate changes only"
    }
  ],
  "command": {
    "name": "codex-pr-review",
    "preview": "Review PR #1 and write a local report.",
    "execute": false
  },
  "approval": {
    "status": "approved",
    "approval_id": "demo-pr-review-001",
    "approved_by": "main-maintainer",
    "approved_at": "2026-06-04T00:00:00Z",
    "expires_at": "2099-01-01T00:00:00Z"
  }
}
