{
  "schema_version": "iosk.approval.v1",
  "operation": "ci_failure_analysis",
  "repository": "monolith-droid/io-safety-kit-for-oss",
  "requested_by": "main-maintainer",
  "reason": "Regression fixture proving branch protection changes fail closed.",
  "risk_level": "high",
  "allowed_actions": [
    "read_ci_logs",
    "disable_branch_protection_on_main",
    "write_local_report"
  ],
  "targets": [
    {
      "type": "branch",
      "ref": "main",
      "purpose": "blocked action regression fixture"
    }
  ],
  "command": {
    "name": "blocked-disable-branch-protection-fixture",
    "preview": "This fixture must never be allowed.",
    "execute": false
  },
  "approval": {
    "status": "approved",
    "approval_id": "blocked-disable-branch-protection-fixture",
    "approved_by": "fixture",
    "approved_at": "2026-06-04T00:00:00Z",
    "expires_at": "2099-01-01T00:00:00Z"
  }
}
